{
  "$schema": "https://json-schema.org/draft/2020-12/schema",
  "$id": "https://tinyassets.io/schemas/source-record.json",
  "title": "SourceRecord",
  "type": "object",
  "additionalProperties": false,
  "required": [
    "id",
    "display_name",
    "origin",
    "addresses",
    "sign_in",
    "invoke",
    "egress",
    "state"
  ],
  "properties": {
    "id": {
      "type": "string",
      "pattern": "^[a-z0-9][a-z0-9_-]{1,63}$"
    },
    "display_name": {
      "type": "string",
      "minLength": 1
    },
    "origin": {
      "enum": [
        "declared",
        "detected"
      ]
    },
    "addresses": {
      "type": "array",
      "minItems": 1,
      "items": {
        "type": "string",
        "format": "uri",
        "pattern": "^https://"
      }
    },
    "suggested": {
      "type": "boolean",
      "default": false
    },
    "execution": {
      "type": "object",
      "description": "Where the source's work may run, how it bills and whom it may serve (W1).",
      "additionalProperties": false,
      "required": [
        "placement",
        "billing",
        "serves"
      ],
      "properties": {
        "placement": {
          "type": "array",
          "minItems": 1,
          "uniqueItems": true,
          "items": {
            "enum": [
              "vendor",
              "thin_loop",
              "device",
              "hosted_box"
            ]
          }
        },
        "billing": {
          "type": "array",
          "minItems": 1,
          "uniqueItems": true,
          "items": {
            "enum": [
              "plan",
              "free",
              "metered"
            ]
          }
        },
        "serves": {
          "enum": [
            "owner_only",
            "may_serve_others"
          ]
        }
      }
    },
    "models": {
      "type": "array",
      "items": {
        "type": "object",
        "required": [
          "id",
          "context"
        ]
      }
    },
    "ranking": {
      "type": [
        "object",
        "null"
      ]
    },
    "egress": {
      "type": "object",
      "minProperties": 1,
      "additionalProperties": {
        "type": "array",
        "minItems": 1,
        "items": {
          "type": "string",
          "pattern": "^[a-z0-9][a-z0-9.-]*[a-z0-9]$"
        }
      }
    },
    "state": {
      "oneOf": [
        {
          "type": "object",
          "required": [
            "location"
          ],
          "properties": {
            "location": {
              "const": "broker"
            }
          },
          "additionalProperties": false
        },
        {
          "type": "object",
          "required": [
            "location",
            "paths"
          ],
          "properties": {
            "location": {
              "const": "broker"
            },
            "paths": {
              "type": "array",
              "minItems": 1,
              "items": {
                "type": "string",
                "minLength": 1
              }
            }
          },
          "additionalProperties": false
        }
      ]
    },
    "sign_in": {
      "oneOf": [
        {
          "type": "object",
          "required": [
            "oauth"
          ],
          "additionalProperties": false,
          "properties": {
            "oauth": {
              "type": "object",
              "required": [
                "issuer",
                "authorization_endpoint",
                "token_endpoint",
                "pkce",
                "client_strategy"
              ],
              "properties": {
                "pkce": {
                  "const": "S256"
                },
                "client_strategy": {
                  "enum": [
                    "dcr",
                    "metadata_document",
                    "public_client"
                  ]
                }
              }
            }
          }
        },
        {
          "type": "object",
          "required": [
            "cli_login"
          ],
          "additionalProperties": false,
          "properties": {
            "cli_login": {
              "type": "object",
              "required": [
                "install",
                "login"
              ],
              "properties": {}
            }
          }
        },
        {
          "type": "object",
          "required": [
            "api_key"
          ],
          "additionalProperties": false,
          "properties": {
            "api_key": {
              "type": "object",
              "required": [
                "header_style"
              ],
              "properties": {
                "header_style": {
                  "const": "bearer"
                }
              }
            }
          }
        }
      ]
    },
    "invoke": {
      "oneOf": [
        {
          "type": "object",
          "required": [
            "http"
          ],
          "additionalProperties": false,
          "properties": {
            "http": {
              "type": "object",
              "required": [
                "wire",
                "base_url",
                "models_url",
                "inference_url"
              ],
              "properties": {
                "wire": {
                  "const": "chat_completions"
                }
              }
            }
          }
        },
        {
          "type": "object",
          "required": [
            "cli"
          ],
          "additionalProperties": false,
          "properties": {
            "cli": {
              "type": "object",
              "required": [
                "argv",
                "format"
              ],
              "properties": {
                "format": {
                  "enum": [
                    "json",
                    "jsonl",
                    "text"
                  ]
                }
              }
            }
          }
        }
      ]
    }
  },
  "allOf": [
    {
      "if": {
        "properties": {
          "sign_in": {
            "required": [
              "cli_login"
            ]
          }
        }
      },
      "then": {
        "properties": {
          "invoke": {
            "required": [
              "cli"
            ]
          },
          "state": {
            "properties": {
              "location": {
                "const": "broker"
              }
            }
          }
        }
      },
      "else": {
        "properties": {
          "invoke": {
            "required": [
              "http"
            ]
          },
          "state": {
            "properties": {
              "location": {
                "const": "broker"
              }
            }
          }
        }
      }
    },
    {
      "if": {
        "properties": {
          "sign_in": {
            "required": [
              "cli_login"
            ]
          }
        }
      },
      "then": {
        "properties": {
          "execution": {
            "properties": {
              "placement": {
                "items": {
                  "enum": [
                    "hosted_box",
                    "device"
                  ]
                }
              }
            }
          }
        }
      }
    },
    {
      "if": {
        "required": [
          "execution"
        ],
        "properties": {
          "execution": {
            "anyOf": [
              {
                "properties": {
                  "placement": {
                    "contains": {
                      "const": "device"
                    }
                  }
                }
              },
              {
                "properties": {
                  "billing": {
                    "contains": {
                      "const": "plan"
                    }
                  }
                }
              }
            ]
          }
        }
      },
      "then": {
        "properties": {
          "execution": {
            "properties": {
              "serves": {
                "const": "owner_only"
              }
            }
          }
        }
      }
    }
  ]
}
