{
  "id": "google_ai_studio",
  "display_name": "Google AI Studio",
  "origin": "declared",
  "addresses": [
    "https://generativelanguage.googleapis.com/v1beta/openai",
    "https://generativelanguage.googleapis.com"
  ],
  "suggested": false,
  "execution": {
    "placement": [
      "thin_loop"
    ],
    "billing": [
      "free"
    ],
    "serves": "owner_only"
  },
  "sign_in": {
    "api_key": {
      "header_style": "bearer",
      "help_url": "https://aistudio.google.com/apikey"
    }
  },
  "invoke": {
    "http": {
      "wire": "chat_completions",
      "base_url": "https://generativelanguage.googleapis.com/v1beta/openai",
      "models_url": "https://generativelanguage.googleapis.com/v1beta/openai/models",
      "inference_url": "https://generativelanguage.googleapis.com/v1beta/openai/chat/completions",
      "card": {
        "help_url": "https://aistudio.google.com/apikey",
        "billing_url": "https://aistudio.google.com/billing",
        "offer": "Free tier on eligible Gemini models; project and model limits apply. Daily requests reset at midnight Pacific.",
        "daily_reset_timezone": "America/Los_Angeles",
        "wire": "openai_chat",
        "terms": "Google's free tier may use your prompts to improve its products, is for ages 18+, and is not offered to users in the EEA, UK or Switzerland.",
        "daily_cap": {
          "requests_per_day": null,
          "tokens_per_minute": null,
          "reset_timezone": "America/Los_Angeles",
          "source_url": "https://ai.google.dev/gemini-api/docs/rate-limits"
        }
      }
    }
  },
  "egress": {
    "provider": [
      "generativelanguage.googleapis.com"
    ]
  },
  "state": {
    "location": "broker"
  },
  "models": [
    {
      "id": "gemini-2.5-flash",
      "context": 32768
    },
    {
      "id": "gemini-2.5-flash-lite",
      "context": 32768
    },
    {
      "id": "gemini-3.1-flash-lite",
      "context": 32768
    }
  ]
}
